{
  "contract_version": "1.0.0",
  "packet_id": "packet_001",
  "owner_id": "owner_001",
  "report_id": "report_001",
  "report_revision": 1,
  "report_digest": "d44b67af2c7403638038d0aedb274b491ac33f001d002f883bbb82fd3afe54d5",
  "created_at": "2026-09-26T20:04:00Z",
  "locale": "en-US",
  "interpretation_database_version": "premium-interpretation-db/1",
  "interpretation_database_sha256": "8b2dcc79fca0f9b6f8e32385464b9d329c316b0b2d714661111a1b0f19c2b37c",
  "question_pack_id": "PREMIUM_INDIVIDUAL_GRAPHIC_V1",
  "candidate_policy_version": "graphology-candidate-validation/1",
  "prompt_version": "premium-prompt/1",
  "output_schema_version": "premium-analysis/1",
  "allowed_fact_ids": [
    "fact_img_width"
  ],
  "questions": [
    {
      "question_id": "Q_CTX_TASK",
      "selection_domain": "FIXED",
      "cardinality": "SINGLE",
      "candidate_ids": [
        "candidate_task_copy"
      ],
      "support_fact_ids": [
        "fact_img_width"
      ]
    }
  ],
  "candidates": [
    {
      "candidate_id": "candidate_task_copy",
      "kind": "TASK_CONTEXT",
      "label_key": "candidate.task.copy",
      "support_fact_ids": [
        "fact_img_width"
      ]
    }
  ],
  "image_asset_id": "asset_001",
  "soft_field_ids": [
    "SOFT_GRAPHIC_PORTRAIT",
    "SOFT_COMBINATION",
    "SOFT_LIMITATION"
  ]
}
